{
  "knowledge_id": "rmse",
  "title": "均方根误差",
  "domain": "model_evaluation",
  "level": "beginner",
  "summary": "衡量预测误差。",
  "definition": "RMSE 是平方误差平均值的平方根。",
  "formula_tex": "\\operatorname{RMSE}",
  "intuition": ["计算误差", "平方", "求平均"],
  "failure_modes": ["异常值敏感"],
  "evidence_requirements": ["metric_value"],
  "related": ["mae"],
  "sources": [{"source_id": "otexts_fpp3", "locator": "https://otexts.com/fpp3/"}]
}
